{
  "stepId": "33333333-3333-4333-8333-333333333333",
  "goalHash": "aaaaaaaaaaaaaaaaaaaaaaaaaaaaaaaaaaaaaaaaaaaaaaaaaaaaaaaaaaaaaaaa",
  "sourceBindingId": "44444444-4444-4444-8444-444444444444",
  "scopeRevisionId": "55555555-5555-4555-8555-555555555555",
  "fieldPolicyVersion": "field-policy-1.0.0",
  "queryTemplateVersion": "query-template-1.0.0",
  "maxCalls": 10,
  "expiresAt": "2026-09-28T10:00:00Z",
  "expectedRowVersion": 2,
  "decision": "APPROVED"
}
